id,order,category_id,ka,en,ru,price,vegetarian,topRated,soldOut,description_ka,description_en,description_ru,story_ka,story_en
dish_0032,110,cat_0002,"სალათი ""ჩერო""",Cherro salad,Салат «Черро»,35,FALSE,FALSE,FALSE,"რუკოლა, არტიშოკი, ჩერი, მწყერის კვერცხი, ბადრიჯანი, ბალზამირებული სოუსი)","Arugula, artichoke, cherry tomatoes, quail eggs, eggplant, balsamic sauce","Руккола, артишок, помидоры черри, перепелиные яйца, баклажан, бальзамический соус",Our signature salad! Created by our chef to highlight the best ingredients of the season. Expect a unique combination of textures and flavors that you won't find anywhere else.,"საფირმო სალათი, შექმნილი სპეციალურად ჩვენი სტუმრებისთვის. ინგრედიენტების უნიკალური ბალანსი, რომელსაც სხვაგან ვერ ნახავთ."
dish_0033,120,cat_0002,ცხელი სალათი,Hot salad,Горячий салат,28,FALSE,FALSE,FALSE,"ქათმის ფილე, ბულგარული წიწაკა, სოკო, სოიოს სოუსი","Chicken fillet, bell pepper, mushrooms, soy sauce","Куриное филе, болгарский перец, грибы, соевый соус","Who says salads must be cold? Warm grilled vegetables or sautéed meats are tossed with fresh greens. The heat wilts the leaves slightly, releasing more flavor and creating a comforting dish.","ვინ თქვა, რომ სალათი ცივი უნდა იყოს? შემწვარი ბოსტნეული ან ხორცი ცოცხალ მწვანილთან ერთად - კომფორტული და გემრიელი არჩევანი."
dish_0034,130,cat_0002,რუკოლას სალათი საქონლის ენით,Arugula salad with beef tongue,Салат из рукколы с говяжьим языком,27,FALSE,FALSE,FALSE,,,,A sophisticated pairing. The peppery bite of arugula cuts through the richness of the tender beef tongue. A balsamic or vinaigrette dressing ties these bold flavors together.,დახვეწილი დუეტი. რუკოლას პიკანტური გემო იდეალურად აბალანსებს მოხარშული ენის ცხიმიანობას. გურმანების საყვარელი სალათი.
dish_0035,140,cat_0002,რუკოლას სალათი კრევეტებით,Arugula salad with shrimps,Салат из рукколы с креветками,32,FALSE,FALSE,FALSE,"რუკოლა, ჩერი, კრევეტები, პარმეზანი","Arugula, cherry, shrimp, parmesan","Руккола, черри, креветки, пармезан","Light and zesty. The spicy notes of fresh arugula are the perfect backdrop for sweet, succulent shrimps. A modern dish that feels like a summer breeze on a plate.","მსუბუქი და არომატული. რუკოლას სიმკვეთრე და კრევეტების სიტკბო - თანამედროვე კერძი, რომელიც ზაფხულის განწყობას შეგიქმნით."
dish_0036,150,cat_0002,"სალათი ""ბორა-ბორა""",Bora Bora salad,Салат «Бора-Бора»,28,FALSE,FALSE,FALSE,"კიტრი, ავოკადო, კრევეტები","Cucumber, avocado, shrimp","Огурец, авокадо, креветки","An exotic mix bringing tropical vibes to the table. Expect a fusion of sweet and savory, possibly featuring fruits like pineapple or mango alongside savory proteins for a refreshing twist.","ეგზოტიკური მოგზაურობა თეფშზე. ტროპიკული ხილისა და ხორცეულის თამამი შეხამება, რომელიც ტრადიციული გემოებისგან განსხვავებულ გამოცდილებას გთავაზობთ."
dish_0037,10,cat_0003,ქაბაბი,Kebab,Кебаб,22,FALSE,FALSE,FALSE,ნახშირზე შემწვარი საქონლისა და ღორის ფარში,minced beef and pork roasted over charcoal,"говяжий и свиной фарш, запеченный на углях","Ground meat spiced with onions and herbs, molded onto a skewer and grilled over charcoal. Known as 'Kababi' in Georgia, it's often served wrapped in thin lavash bread with onions and sumac.","წვნიანი და არომატული. ტრადიციული რეცეპტით შეკაზმული ხორცი, შემწვარი ნაკვერჩხალზე. თხელ ლავაშსა და ხახვთან ერთად - ნამდვილი სიამოვნება."
dish_0038,20,cat_0003,ქაბაბი სულგუნით,Kebab with Sulguni,Кебаб с сулгуни,24,FALSE,FALSE,FALSE,ნახშირზე შემწვარი საქონლისა და ღორის ფარში სულგუნით,Charcoal-grilled beef and pork with sulguni,"Говядина и свинина, приготовленные на древесных углях, с добавлением сулгуни.","A surprise inside! The traditional kebab is stuffed with a stick of Sulguni cheese. When grilled, the cheese melts, creating a gooey, savory core inside the juicy meat.",სიურპრიზი შიგთავსში! ქაბაბი სულგუნის გულით. დაჭრისას მდნარი ყველი იღვრება და ხორცს კიდევ უფრო წვნიანს და გემრიელს ხდის.
dish_0039,30,cat_0003,ბოსტნეულის მწვადი,Vegetable barbecue,Овощной шашлык,20,FALSE,FALSE,FALSE,"ბადრიჯანი, ბულგარული წიწაკა, პომიდორი, სოკო","Eggplant, bell pepper, tomato, mushroom","Баклажан, болгарский перец, помидор, гриб","Smoky and sweet. Skewered bell peppers, eggplants, and mushrooms are grilled over embers. The fire enhances their natural sugars, making this a fantastic vegetarian main or side.","ბოსტნეული მაყალზე. შებრაწული ბადრიჯანი, წიწაკა და სოკო, რომლებსაც კვამლის არომატი დაუვიწყარ გემოს სძენს. იდეალური გარნირი ან დამოუკიდებელი კერძი."
dish_0040,40,cat_0003,ბატკნის მწვადი,Lamb barbecue,Шашлык из баранины,45,FALSE,FALSE,FALSE,,,,"A classic of the Caucasus. Chunks of lamb are marinated and grilled to perfection. The fat renders over the fire, dripping onto the coals and creating that unmistakable smoky aroma.","კავკასიური კლასიკა. ნაკვერჩხალზე შემწვარი ბატკნის ნაჭრები. ხორცის ბუნებრივი არომატი, რომელსაც მხოლოდ მარილი და ცეცხლი სჭირდება."
dish_0041,50,cat_0003,ღორის მწვადი,Pork barbecue,Шашлык из свинины,23,FALSE,FALSE,FALSE,,,,"Georgia's national obsession, 'Mtsvadi'. Often made from pork neck, it’s traditionally grilled on vine branches (tsalami) for a unique flavor. No marinade is needed, just salt and fire!","ქართული მწვადი - სუფრის მშვენება. საუკეთესო ხორცის ნაჭრები, შემწვარი წალამზე ან ნაკვერჩხალზე. კერძი, რომელსაც წარდგენა არ სჭირდება."
dish_0042,60,cat_0003,კალმახი შამფურზე,Trout on a skewer,Форель на шампуре,20,FALSE,FALSE,FALSE,,,,"Whole trout, skewered and grilled. The skin becomes crispy while the flesh remains tender and flaky. It’s a simple preparation that honors the clean taste of the mountain river fish.",მთის მდინარის გემო. შამფურზე შემწვარი მთლიანი კალმახი. ხრაშუნა კანი და ნაზი ხორცი - მარტივი და გენიალური.
dish_0043,70,cat_0003,ქაბაბი ქათმის ხორცით,Chicken kebab,Куриный кебаб,20,FALSE,FALSE,FALSE,,,,"A lighter alternative to beef or pork. Minced chicken is seasoned with herbs and spices, then grilled. It’s juicy, flavorful, and pairs perfectly with a squeeze of lemon.","მსუბუქი ალტერნატივა. შეკაზმული ქათმის ფარში, შემწვარი მაყალზე. წვნიანი და დიეტური, განსაკუთრებით უხდება ლიმონი."
dish_0044,80,cat_0003,მწვადის ასორტი,Assorted barbecue,Ассорти из шашлыков,150,FALSE,FALSE,FALSE,,,,"The ultimate meat feast! A platter featuring pork, chicken, and kebab skewers. Perfect for sharing, it offers a taste of everything the grill master has to offer.","ხორცის მოყვარულთა ოცნება. ღორის, ქათმისა და ქაბაბის ნაკრები ერთ ლანგარზე. იდეალურია მეგობრებთან ერთად გასაზიარებლად."
dish_0045,90,cat_0003,ქათმის მწვადი,Chicken barbecue,Шашлык из курицы,20,FALSE,FALSE,FALSE,,,,"Marinated chicken chunks grilled over charcoal. The marinade, often yogurt or vinegar-based, keeps the meat tender and juicy while the fire adds a delicious char.","ქათმის მწვადი - ნაზი და არომატული. მარინადში დავარგებული ხორცი, რომელიც ნაკვერჩხალზე შეწვისას ინარჩუნებს სირბილეს."
dish_0046,100,cat_0003,ღორის ნეკნის მწვადი,Pork rib barbecue,Шашлык из свиных ребрышек,25,FALSE,FALSE,FALSE,,,,"For those who love meat on the bone. Pork ribs are grilled until the meat pulls away from the bone. The fat renders down to create a sticky, savory crust.","მათთვის, ვისაც ხორცი ძვალზე უყვარს. შებრაწული ნეკნები, რომლებსაც ცხიმი განსაკუთრებულ გემოსა და სირბილეს მატებს."
dish_0047,110,cat_0003,ქათმის ფრთები,Chicken wings,Куриные крылышки,20,FALSE,FALSE,FALSE,,,,"Crispy, smoky, and addictive. Grilled chicken wings are a universal favorite. Perfect as a snack with beer or a meal on their own, seasoned to perfection.",ხრაშუნა და მიმზიდველი. მაყალზე შემწვარი ფრთები - საუკეთესო არჩევანი ლუდთან ან უბრალოდ წასახემსებლად.
dish_0048,120,cat_0003,კრევეტები,Shrimp,Креветки,32,FALSE,FALSE,FALSE,,,,"Grilled or fried, shrimps are a treat. In Georgia, they are often cooked simply with lemon and garlic to highlight their natural sweetness. A taste of the Black Sea coast.","შემწვარი კრევეტები - ზღვის ნიავი თქვენს თეფშზე. მომზადებული მარტივად, ლიმონითა და ნივრით, რათა არ დაიკარგოს პროდუქტის ბუნებრივი სიტკბო."
dish_0049,10,cat_0004,პური,Bread,Хлеб,3,FALSE,FALSE,FALSE,,,,"Georgian bread, 'Puri', is sacred. Traditionally baked in a clay oven called a 'Tone', it has a crispy crust and a soft, chewy interior. It’s the utensil for scooping up sauces and cheese.","ქართული პური - სუფრის გული. თონეში გამომცხვარი, ხრაშუნა ყუათა და რბილი გულით. ყველაზე გემრიელი „კოვზი“ საწებლებისთვის."
dish_0050,20,cat_0004,მჭადი კეცზე,Mchadi on a ketsi,Мчади на кеци,5,FALSE,FALSE,FALSE,"სიმინდის ფქვილი, წყალი, მარილი, ზეთი","Cornmeal, water, salt, oil",Грузинский кукурузный хлеб,"Traditional cornbead fried in a clay pan (ketsi). Crunchy on the outside and hot on the inside, it’s the best friend of cheese, specifically Imeretian or Sulguni.","კეცზე გამომცხვარი სიმინდის კვერი. გარედან ხრაშუნა, შიგნით ცხელი - ყველისა და ლობიოს განუყრელი მეგობარი."
dish_0051,30,cat_0004,ჭვიშტვარი,Chvishtvari,Чвиштвари,15,FALSE,FALSE,FALSE,"სიმინდის ფქვილი, სულგუნი, წყალი/რძე, მარილი, ზეთი","Cornmeal, Sulguni cheese, water/milk, salt, oil",Грузинский кукурузный хлеб с сыром,"Mchadi's rich cousin from Svaneti or Samegrelo. Cheese is mixed directly into the cornmeal dough before frying, creating a cheesy, stretchy, savory cornbread delight.","სვანური სტუმართმოყვარეობა. სიმინდის ცომში ჩაზელილი ყველი, რომელიც შეწვისას დნება და კერძს საოცრად გემრიელსა და ნოყიერს ხდის."
dish_0052,40,cat_0004,ხაჭაპური იმერული,Imeretian Khachapuri,Имеретинский хачапури,20,FALSE,FALSE,FALSE,"ცომი (ხორბლის ფქვილი, წყალი, საფუარი, მარილი), იმერული ყველი, კვერცხი, კარაქი","Dough (wheat flour, water, yeast, salt), Imeretian cheese, egg, butter",,"The classic cheese bread. A round dough filled with Imeretian cheese. It’s the most common type, beloved for its soft dough and uniform, savory filling.","ყველასთვის საყვარელი კლასიკა. იმერული ყველისა და რბილი ცომის იდეალური ბალანსი. ეს არის ხაჭაპური, რომელიც არასდროს გვბეზრდება."
dish_0053,50,cat_0004,ხაჭაპური მეგრული,Megrelian Khachapuri,Мегрельский хачапури,25,FALSE,FALSE,FALSE,"ცომი, იმერული ყველი, სულგუნი, კარაქი, კვერცხი","Dough, Imeretian cheese, Sulguni cheese, butter, egg",,"Double the cheese, double the joy! Similar to Imeretian, but topped with an extra layer of cheese before baking. It creates a golden, bubbly crust that cheese lovers adore.","ორმაგი ყველი, ორმაგი სიამოვნება! ზემოდან მოყრილი სულგუნი ცხვება და ქმნის ოქროსფერ, ხრაშუნა ქერქს. ყველის მოყვარულთა არჩევანი."
dish_0054,60,cat_0004,ხაჭაპური აჭარული (ცომგამოცლილი),Adjarian Khachapuri (dough-rolled),Аджарский Хачапури (раскатанный в тесте),24,FALSE,FALSE,FALSE,,,,"A variation of the famous boat shape. The dough is rolled thinner for a crispier texture, focusing more on the filling of cheese, butter, and egg.","აჭარულის თანამედროვე ვერსია. გაბრტყელებული ცომი, ნაკლები ყუა და უფრო ხრაშუნა ტექსტურა - მათთვის, ვისაც მეტი გულსართი უყვარს."
dish_0055,70,cat_0004,ხაჭაპური აჭარული,Adjarian Khachapuri,Аджарский хачапури,22,FALSE,FALSE,FALSE,"ცომი, ყველის ნაზავი (იმერული/სულგუნი), კვერცხი, კარაქი","Dough, mixed cheese (Imeretian/Sulguni), egg, butter",,The boat-shaped icon. Filled with cheese and topped with a raw egg and a stick of butter. You mix it all together before eating. It represents the sun (egg) and the sea (cheese).,"მზე და ზღვა თეფშზე. ნავის ფორმის ცომი, ყველი, კარაქი და კვერცხი. მირთმევის რიტუალი - ყველაფრის არევა - კერძს კიდევ უფრო გემრიელს ხდის."
dish_0056,80,cat_0004,ხაჭაპური შამფურზე,Khachapuri on a skewer,Хачапури на вертеле,30,FALSE,FALSE,FALSE,,,,"A feat of engineering! Cheese is threaded onto a skewer, wrapped in dough, and grilled. The result is a smoky, crispy tube of dough with a molten cheese center.",გემრიელი ინჟინერია. შამფურზე დახვეული ცომი და სულგუნი. მაყალზე მომზადებული ხაჭაპური კვამლის არომატით - დაუვიწყარი სანახაობა და გემო.
dish_0057,90,cat_0004,ხაჭაპური საფირმო,Khachapuri Sapirmo,Хачапури Сапирмо,30,FALSE,FALSE,FALSE,,,,"A special variation, often larger or with a different dough layering technique. 'Sapirmo' implies it's fit for a feast, designed to impress with its size and flavor.","სადღესასწაულო ხაჭაპური. დიდი ზომის, მდიდრული გულსართით - შექმნილია იმისთვის, რომ სუფრაზე მთავარი ადგილი დაიკავოს."
dish_0058,100,cat_0004,ლობიანი,Lobiani,Лобиани,18,FALSE,FALSE,FALSE,"ცომი, ლობიო, ხახვი, სუნელები, ზეთი/ღორის ქონი","Dough, kidney beans, onions, spices, oil/pork fat",,"A bean-filled bread from Racha. Mashed kidney beans, seasoned with ham or bacon fat, are stuffed into the dough. It’s a savory, hearty alternative to cheese bread.","რაჭული ტრადიცია. ლობიოს გულსართით და ღორის ქონით შეკაზმული ცომი. ნოყიერი და არომატული, განსაკუთრებით კარგია ზამთარში."
dish_0059,110,cat_0004,აჭარული ლობიანი,Adjarian Lobiani,Аджарский Лобиани,20,FALSE,FALSE,FALSE,,,,"Lobiani shaped like an Adjarian Khachapuri boat. Instead of cheese, the open boat is filled with spicy bean mash, sometimes topped with butter or bacon for extra richness.","ლობიანი აჭარულად. ნავის ფორმაში გამომცხვარი ლობიო, ხშირად კარაქით ან შებოლილი ხორცით. საინტერესო ვიზუალი და ნაცნობი გემო."
dish_0060,120,cat_0004,აჩმა,Achma,Ачма,10,FALSE,FALSE,FALSE,,,,"The Georgian lasagna. Layers of boiled dough and cheese are baked together to create a fluffy, buttery, cheesy casserole. It’s distinct from other Khachapuris due to its unique texture.","ქართული ლაზანია. ფენებად ჩაწყობილი მოხარშული ცომი და ყველი. ფუმფულა, კარაქიანი და ძალიან ნოყიერი - აჭარული სამზარეულოს სიამაყე."
dish_0061,130,cat_0004,ღომი,Gomi,Гоми,10,FALSE,FALSE,FALSE,"ღერღილი, სიმინდის ფქვილი, წყალი","Coarse cornmeal (gherghili), fine cornmeal, water",,"The staple of Western Georgia (Samegrelo). A hot porridge made from white cornmeal. Neutral in flavor, it is the perfect canvas for melting strips of Sulguni cheese.","სამეგრელოს სავიზიტო ბარათი. ღერღილის ფაფა, რომელშიც სულგუნის ფირფიტები დნება. ცხელი ღომი და ცივი ყველი - კონტრასტი, რომელიც ყველას უყვარს."
dish_0062,140,cat_0004,პილმენი,Dumplings,Пельмени,18,FALSE,FALSE,FALSE,,,,"Likely 'Pelmeni' or similar. Small pockets of dough filled with meat, boiled and served with butter or sour cream. A comfort food that warms the soul.","პელმენი - კომფორტული საკვები. ხორცის პატარა გუნდები ცომში, მოხარშული და მირთმეული კარაქთან ან არაჟანთან ერთად."
dish_0063,150,cat_0004,ელარჯი,Elarji,Эларджи,20,FALSE,FALSE,FALSE,"ღერღილი, სიმინდის ფქვილი, სულგუნი, წყალი","Coarse cornmeal, fine cornmeal, Sulguni cheese, water",,"A mesmerizing dish of Gomi mixed with excessive amounts of Sulguni cheese until it becomes a single, super-stretchy mass. Watching it being served is a show in itself!","სანახაობრივი კერძი! ღომისა და სულგუნის ნაზავი, რომელიც იმდენ ხანს იზილება, სანამ ერთ მთლიან, წელვად მასად არ იქცევა. მეგრული მასპინძლობის პიკი."
dish_0064,160,cat_0004,პიცა მარგარიტა,Pizza Margherita,Пицца Маргарита,26,FALSE,FALSE,FALSE,"პიცის ცომი, ტომატის სოუსი, ყველი მოცარელა, ცოცხალი ბაზილიკი, ზეითუნის ზეთი","Pizza dough, tomato sauce, mozzarella cheese, fresh basil, olive oil",,"The queen of pizzas. Named after Queen Margherita of Savoy, it features the colors of the Italian flag: red tomatoes, white mozzarella, and green basil. Simple and perfect.","იტალიური დროშის ფერები. პომიდორი, მოცარელა და ბაზილიკი. სიმარტივეშია გენიალობა - პიცა, რომელიც ყველას უყვარს."
dish_0065,170,cat_0004,პიცა პეპერონი,Pizza Pepperoni,Пицца Пепперони,28,FALSE,FALSE,FALSE,"პიცის ცომი, ტომატის სოუსი, ყველი მოცარელა, ძეხვი პეპერონი","Pizza dough, tomato sauce, mozzarella cheese, pepperoni salami",,"A favorite worldwide. Spicy salami slices atop cheese and tomato sauce. The oils from the pepperoni seep into the cheese, creating a spicy, savory kick.","პიკანტური არჩევანი. ცხარე ძეხვი, ყველი და ტომატის სოუსი. მსოფლიოში ერთ-ერთი ყველაზე პოპულარული პიცა."
